<?xml version="1.0" encoding="UTF-8"?>
<list xmlns="http://www.l2jfree.com"
  xmlns:xsi="http://www.w3.org/2001/XMLSchema-instance"
  xsi:schemaLocation="http://www.l2jfree.com ../templates/exchange.xsd">
  <item id="1">
    <ingredient id="10327" count="200" />
    <production id="9967" count="1" />
  </item>
  <item id="2">
    <ingredient id="10327" count="200" />
    <production id="9968" count="1" />
  </item>
  <item id="3">
    <ingredient id="10327" count="200" />
    <production id="9969" count="1" />
  </item>
  <item id="4">
    <ingredient id="10327" count="200" />
    <production id="9970" count="1" />
  </item>
  <item id="5">
    <ingredient id="10327" count="200" />
    <production id="9971" count="1" />
  </item>
  <item id="6">
    <ingredient id="10327" count="200" />
    <production id="9972" count="1" />
  </item>
  <item id="7">
    <ingredient id="10327" count="200" />
    <production id="9973" count="1" />
  </item>
  <item id="8">
    <ingredient id="10327" count="200" />
    <production id="9974" count="1" />
  </item>
  <item id="9">
    <ingredient id="10327" count="200" />
    <production id="9975" count="1" />
  </item>
 </list>
