<?xml version="1.0" encoding="UTF-8"?>
<!-- Seven Signs - Blacksmith of Mammon - Unseal S80-grade Accesories -->
<list maintainEnchantment="true" xmlns="http://www.l2jfree.com"
  xmlns:xsi="http://www.w3.org/2001/XMLSchema-instance"
  xsi:schemaLocation="http://www.l2jfree.com ../templates/exchange.xsd">
  <!-- Dynasty Earings  -->
  <item id="1">
    <production id="9455" count="1"/>
    <ingredient id="9452" count="1"/>
    <ingredient id="5575" count="9882489"/>
  </item>
  <!-- Dynasty Necklace  -->
  <item id="2">
    <production id="9456" count="1"/>
    <ingredient id="9453" count="1"/>
    <ingredient id="5575" count="13176652"/>
  </item>
  <!-- Dynasty Rings  -->
  <item id="3">
    <production id="9457" count="1"/>
    <ingredient id="9454" count="1"/>
    <ingredient id="5575" count="6538326"/>
  </item>
  <!-- Masterwork Dynasty Earings -->
  <item id="4">
    <production id="11601" count="1"/>
    <ingredient id="11604" count="1"/>
    <ingredient id="5575" count="9882489"/>
  </item>
  <!-- Masterwork Dynasty Necklace -->
  <item id="5">
    <production id="11599" count="1"/>
    <ingredient id="11602" count="1"/>
    <ingredient id="5575" count="13176652"/>
  </item>
  <!-- Masterwork Dynasty Rings -->
  <item id="6">
    <production id="11600" count="1"/>
    <ingredient id="11603" count="1"/>
    <ingredient id="5575" count="6538326"/>
  </item>
</list>