<?xml version="1.0" encoding="UTF-8"?>
<!-- Apella Trader -->
<!-- by Demolidor -->
<list applyTaxes="true" xmlns="http://www.l2jfree.com"
  xmlns:xsi="http://www.w3.org/2001/XMLSchema-instance"
  xsi:schemaLocation="http://www.l2jfree.com ../templates/exchange.xsd">
  <!-- Apella Helm -->
  <item id="1">
    <ingredient id="-200" count="696"/>
    <ingredient id="57" count="1384696" isTaxIngredient="true"/>
    <production id="7860" count="1"/>
  </item>
  <!-- Apella Plate Armor -->
  <item id="2">
    <ingredient id="-200" count="2708"/>
    <ingredient id="57" count="5464522" isTaxIngredient="true"/>
    <production id="7861" count="1"/>
  </item>
  <!-- Apella Gauntlet - Heavy Armor -->
  <item id="3">
    <ingredient id="-200" count="464"/>
    <ingredient id="57" count="923043" isTaxIngredient="true"/>
    <production id="7862" count="1"/>
  </item>
  <!-- Apella Solleret - Heavy Armor -->
  <item id="4">
    <ingredient id="-200" count="464"/>
    <ingredient id="57" count="923043" isTaxIngredient="true"/>
    <production id="7863" count="1"/>
  </item>
  <!-- Apella Brigandine -->
  <item id="5">
    <ingredient id="-200" count="2032"/>
    <ingredient id="57" count="4100130" isTaxIngredient="true"/>
    <production id="7864" count="1"/>
  </item>
  <!-- Apella Leather Gloves - Light Armor -->
  <item id="6">
    <ingredient id="-200" count="464"/>
    <ingredient id="57" count="923043" isTaxIngredient="true"/>
    <production id="7865" count="1"/>
  </item>
  <!-- Apella Boots - Light Armor -->
  <item id="7">
    <ingredient id="-200" count="464"/>
    <ingredient id="57" count="923043" isTaxIngredient="true"/>
    <production id="7866" count="1"/>
  </item>
  <!-- Apella Doublet -->
  <item id="8">
    <ingredient id="-200" count="2032"/>
    <ingredient id="57" count="4100130" isTaxIngredient="true"/>
    <production id="7867" count="1"/>
  </item>
  <!-- Apella Silk Gloves - Robe -->
  <item id="9">
    <ingredient id="-200" count="464"/>
    <ingredient id="57" count="923043" isTaxIngredient="true"/>
    <production id="7868" count="1"/>
  </item>
  <!-- Apella Sandals - Robe -->
  <item id="10">
    <ingredient id="-200" count="464"/>
    <ingredient id="57" count="923043" isTaxIngredient="true"/>
    <production id="7869" count="1"/>
  </item>
  <!-- Improved Apella Helm -->
  <item id="11">
    <ingredient id="-200" count="1046"/>
    <ingredient id="9912" count="26"/>
    <ingredient id="57" count="2087652" isTaxIngredient="true"/>
    <production id="9830" count="1"/>
  </item>
  <!-- Improved Apella Plate Armor -->
  <item id="12">
    <ingredient id="-200" count="4532"/>
    <ingredient id="9912" count="115"/>
    <ingredient id="57" count="9050087" isTaxIngredient="true"/>
    <production id="9831" count="1"/>
  </item>
  <!-- Improved Apella Gauntlet - Heavy Armor -->
  <item id="13">
    <ingredient id="-200" count="697"/>
    <ingredient id="9912" count="18"/>
    <ingredient id="57" count="1391661" isTaxIngredient="true"/>
    <production id="9832" count="1"/>
  </item>
  <!-- Improved Apella Solleret - Heavy Armor -->
  <item id="14">
    <ingredient id="-200" count="697"/>
    <ingredient id="9912" count="18"/>
    <ingredient id="57" count="1391661" isTaxIngredient="true"/>
    <production id="9833" count="1"/>
  </item>
  <!-- Improved Apella Brigandine -->
  <item id="15">
    <ingredient id="-200" count="3399"/>
    <ingredient id="9912" count="86"/>
    <ingredient id="57" count="6788043" isTaxIngredient="true"/>
    <production id="9834" count="1"/>
  </item>
  <!-- Improved Apella Leather Gloves - Light Armor -->
  <item id="16">
    <ingredient id="-200" count="697"/>
    <ingredient id="9912" count="18"/>
    <ingredient id="57" count="1391661" isTaxIngredient="true"/>
    <production id="9835" count="1"/>
  </item>
  <!-- Improved Apella Boots - Light Armor -->
  <item id="17">
    <ingredient id="-200" count="697"/>
    <ingredient id="9912" count="18"/>
    <ingredient id="57" count="1391661" isTaxIngredient="true"/>
    <production id="9836" count="1"/>
  </item>
  <!-- Improved Apella Doublet -->
  <item id="18">
    <ingredient id="-200" count="3399"/>
    <ingredient id="9912" count="86"/>
    <ingredient id="57" count="6788043" isTaxIngredient="true"/>
    <production id="9837" count="1"/>
  </item>
  <!-- Improved Apella Silk Gloves - Robe -->
  <item id="19">
    <ingredient id="-200" count="697"/>
    <ingredient id="9912" count="18"/>
    <ingredient id="57" count="1391661" isTaxIngredient="true"/>
    <production id="9838" count="1"/>
  </item>
  <!-- Improved Apella Sandals - Robe -->
  <item id="20">
    <ingredient id="-200" count="697"/>
    <ingredient id="9912" count="18"/>
    <ingredient id="57" count="1391661" isTaxIngredient="true"/>
    <production id="9839" count="1"/>
  </item>
</list>